{
  "schema_version": "1.0.0", "kind": "selective_export",
  "export_id": "33333333-3333-4333-8333-333333333333",
  "vault_id": "44444444-4444-4444-8444-444444444444",
  "created_at": "2026-10-02T21:00:00Z",
  "destination": "Synthetic reading project", "purpose": "Approved title reuse",
  "approval_digest": "aaaaaaaaaaaaaaaaaaaaaaaaaaaaaaaaaaaaaaaaaaaaaaaaaaaaaaaaaaaaaaaa",
  "records": [{"id": "55555555-5555-4555-8555-555555555555", "type": "entity", "revision": 1, "fields": ["name", "type"], "source_capture_ids": ["22222222-2222-4222-8222-222222222222"]}],
  "files": [{"path": "records/entities.json", "size_bytes": 110, "sha256": "bbbbbbbbbbbbbbbbbbbbbbbbbbbbbbbbbbbbbbbbbbbbbbbbbbbbbbbbbbbbbbbb"}]
}
